district,end_date,issued_on,permittee_name,permit_no,address,lat,lng,start_date
WAN CHAI,09/11/2013,10/05/2013,EXCEL ENGINEERING COMPANY LIMITED,GW-RS0509-13,"A section of Kennedy Road near Queen's Road East, Wan Chai, Hong Kong",22.274503,114.173208,13/05/2013
WAN CHAI,13/11/2013,14/05/2013,CHUN WO- LEADER JOINT VENTURE,GW-RS0510-13,"seafront near Hong Kong Convention and Exhibition Centre, Wan Chai, Hong Kong",22.283639,114.1732893,15/05/2013
SOUTHERN,08/09/2013,09/05/2013,MERSING (HK) TRENCHLESS LIMITED,GW-RS0511-13,"Site Area near Sewage Treatment Plant, 50 Lee Nam Road, Ap Lei Chau, Hong Kong (DSD Contract No. DC/2008/09)",-1,-1,10/05/2013
WAN CHAI,14/11/2013,14/05/2013,SUN FOOK KONG (CIVIL) LTD,GW-RS0513-13,"A section of Morrison Hill Road near Sung Tak Street, Wan Chai, Hong Kong",22.275691,114.179714,15/05/2013
WAN CHAI,16/11/2013,14/05/2013,Chun Wo - CRGL Joint Venture,GW-RS0514-13,"A section of Harbour Road near Fleming Road, Wan Chai, Hong Kong",-1,-1,17/05/2013
CENTRAL AND WESTERN,20/08/2013,14/05/2013,Gammon Construction Limited,GW-RS0515-13,MTRC WIL Contract 705 - KET Station & Overun Tunnel (Construction Site from Ex-Police Quarters to Ex KET Swimming Pool Site),-1,-1,21/05/2013
WAN CHAI,26/11/2013,20/05/2013,Chun Wo - CRGL Joint Venture,GW-RS0517-13,"An area near Hung Hing Road, Wan Chai, HK",22.500083,114.129879,27/05/2013
CENTRAL AND WESTERN,13/11/2013,10/05/2013,Sun Fook Kong (Civil) Ltd.,GW-RS0518-13,"Section of Connaught Road West between Eastern Street and Wilmer Street, Hong Kong",22.396428,114.109497,14/05/2013
CENTRAL AND WESTERN,19/11/2013,20/05/2013,"KIER-LAING O'ROURKE-KADEN JOINT VENTURE (KIER CONSTRUCTION LIMITED, LAING O'ROURKE CONSTRU",GW-RS0519-13,"Harcourt Garden, Admiralty, Hong Kong.",22.2784979,114.1664232,20/05/2013
SOUTHERN,30/06/2013,13/05/2013,LEIGHTON CONTRACTORS (ASIA) LIMITED,GW-RS0520-13,"Wong Chuk Hang Road Sitting Out Area near Wong Chuk Hang Road Garden, Wong Chuk Hang, HK",22.239055,114.1706884,16/05/2013
WAN CHAI,21/11/2013,20/05/2013,Chun Wo - CRGL Joint Venture,GW-RS0521-13,"An area near Harbour Centre, Wan Chai, Hong Kong",22.278993,114.171183,22/05/2013
SOUTHERN,29/11/2013,13/05/2013,LEIGHTON - LNS JOINT VENTURE (LEIGHTON CONTRACTORS (ASIA) LIMITED AND LEONHARD NILSEN & SO,GW-RS0523-13,"Site Area near Drainage Services Department Wah Fu Sewage Screening Plant, Waterfall Bay Road, Wah Fu, Hong Kong (DSD Contract No. DC/2007/24)",-1,-1,30/05/2013
CENTRAL AND WESTERN,14/11/2013,13/05/2013,KUM SHING (K. F.) CONSTRUCTCION CO. LTD.,GW-RS0526-13,"2 Hillier Street, Sheung Wan, Hong Kong.",22.2867897,114.152262,15/05/2013
CENTRAL AND WESTERN,28/07/2013,16/05/2013,Creative Facade Engineering Limited,GW-RS0527-13,"Junction of Queen’s Road Central & Pedder Street, Central, Hong Kong",22.281354,114.156919,29/05/2013
WAN CHAI,27/11/2013,20/05/2013,Chun Wo - CRGL Joint Venture,GW-RS0530-13,"Water Supplies Department Salt Water Pumping Station near Wan Shing Street, Wan Chai, HK",22.281981,114.17903,28/05/2013
CENTRAL AND WESTERN,31/10/2013,13/05/2013,PUI HING CONSTRUCTION COMPANY LIMITED,GW-RS0533-13,"Wing Kut Street, Sheung Wan, HK",22.285532,114.154315,13/05/2013
CENTRAL AND WESTERN,28/06/2013,16/05/2013,CHINA HARBOUR ENGINEERING COMPANY LIMITED,GW-RS0534-13,"Kellett Anchorage, Victoria Harbour, Hong Kong.",22.396428,114.109497,26/05/2013
WAN CHAI,15/11/2013,16/05/2013,EXCEL ENGINEERING COMPANY LIMITED,GW-RS0535-13,"Three sections of Queen's Road East between Ship Street and Amoy Street, Wan Chai, HK",22.276285,114.172253,20/05/2013
CENTRAL AND WESTERN,30/08/2013,16/05/2013,Southa Technical Ltd.,GW-RS0537-13,"MTR Central Station, Central, Hong Kong",-1,-1,27/05/2013
CENTRAL AND WESTERN,19/06/2013,20/05/2013,CHUNG CHIN CONSTRUCTION & ENGINEERING CO. LTD.,GW-RS0542-13,"41-51 Queen's Road Central, Central, HK",22.2826136,114.1559017,03/06/2013
SOUTHERN,30/11/2013,20/05/2013,Kum Shing (K F) Construction Co Ltd,GW-RS0543-13,HONG KONG ISLAND & LAMMA ISLAND,22.2000056,114.1350173,01/06/2013
WAN CHAI,30/08/2013,16/05/2013,Southa Technical Ltd.,GW-RS0545-13,"MTR Causeway Bay Station, Hong Kong",22.280209,114.184116,27/05/2013
CENTRAL AND WESTERN,18/11/2013,20/05/2013,CHINA STATE CONSTRUCTION ENGINEERING (HONG KONG) LIMITED,GW-RS0547-13,"3A Chater Road, Central, HK",22.281437,114.161004,20/05/2013
SOUTHERN,15/07/2013,16/05/2013,LEIGHTON CONTRACTORS (ASIA) LIMITED,GW-RS0548-13,"A section of Ocean Park Road near Hong Kong Police College, Wong Chuk Hang, HK",22.239055,114.1706884,17/05/2013
CENTRAL AND WESTERN,18/11/2013,21/05/2013,EXCEL ENGINEERING COMPANY LIMITED,GW-RS0549-13,"84-143 Connaught Road Central, HK",22.287134,114.151552,21/05/2013
CENTRAL AND WESTERN,27/08/2013,20/05/2013,CHINA ROAD AND BRIDGE CORPORATION AND WELCOME CONSTRUCTION COMPANY LIMITED jointly trading,GW-RS0552-13,"Section of Cotton Tree Drive between ICBC Tower and The Helena May Institute, Hong Kong",22.396428,114.109497,27/05/2013
CENTRAL AND WESTERN,25/05/2013,21/05/2013,Dragages - Maeda - BSG Joint Venture,GW-RS0555-13,"8-33 Des Voeux Road West, Sheung Wan, Hong Kong.",22.287855,114.147932,25/05/2013
EASTERN,29/05/2013,08/11/2012,THE HONG KONG AND CHINA GAS COMPANY LIMITED,GW-RS1123-12,Whole of Hong Kong Island and Ap Lei Chau,22.2418581,114.1528532,30/11/2012
SOUTHERN,31/05/2013,02/11/2012,THE HONG KONG ELECTRIC COMPANY LIMITED,GW-RS1137-12,"THE WHOLE OF HONG KONG ISLAND, APLEICHAU AND LAMMA ISLAND",22.2000056,114.1350173,01/12/2012
SOUTHERN,31/05/2013,19/11/2012,Kum Shing (K F) Construction Co Ltd,GW-RS1165-12,HONG KONG ISLAND & LAMMA ISLAND,22.2000056,114.1350173,01/12/2012
SOUTHERN,29/05/2013,19/11/2012,LEIGHTON - LNS JOINT VENTURE (LEIGHTON CONTRACTORS (ASIA) LIMITED AND LEONHARD NILSEN & SO,GW-RS1182-12,"Site Area near Drainage Services Department Wah Fu Sewage Screening Plant, Waterfall Bay Road, Wah Fu, Hong Kong (DSD Contract No. DC/2007/24)",-1,-1,30/11/2012
WAN CHAI,11/06/2013,23/11/2012,CHINA OVERSEAS BUILDING CONSTRUCTION LIMITED,GW-RS1188-12,"I.L. 9018 Mcgregor Street (Site B), Wan Chai, HK (URA H15)",40.6331249,-89.3985283,12/12/2012
CENTRAL AND WESTERN,22/05/2013,16/11/2012,Gammon Construction Limited,GW-RS1194-12,"Bus Terminus, The Forum, Harbour View Street, Central, Hong Kong",22.284593,114.157724,23/11/2012
ISLANDS,30/05/2013,22/11/2012,FUJITA - SUN FOOK KONG JOINT VENTURE,GW-RS1196-12,"Hong Kong International Airport, Outlying Island, NT",22.396428,114.109497,01/12/2012
WAN CHAI,30/07/2013,20/11/2012,THE JARDINE ENGINEERING CORPORATION LIMITED,GW-RS1201-12,"Causeway Bay MTR Station, Causeway Bay, HK",22.280209,114.184116,01/02/2013
WAN CHAI,27/05/2013,21/11/2012,Chun Wo - CRGL Joint Venture,GW-RS1204-12,"Water Supplies Department Salt Water Pumping Station near Wan Shing Street, Wan Chai, HK",22.281981,114.17903,29/11/2012
EASTERN,28/05/2013,29/11/2012,Chun Wo - CRGL - MBEC Joint Venture,GW-RS1210-12,"Island Eastern Corridor, North Point, HK",22.284183,114.221675,29/11/2012
ISLANDS,15/06/2013,03/12/2012,YU HSIN CONSTRUCTION CO. LTD.,GW-RS1214-12,"Cathay Pacific Catering Services, 11 Catering Road East, Outlying Island, NT",-1,-1,16/12/2012
WAN CHAI,30/07/2013,23/11/2012,THE JARDINE ENGINEERING CORPORATION LIMITED,GW-RS1215-12,"MTR Wan Chai Station, Wan Chai, HK",22.277608,114.172967,01/02/2013
CENTRAL AND WESTERN,13/06/2013,23/11/2012,GAMMON CONSTRUCTION LIMITED,GW-RS1218-12,"Junction of Rock Hill Street and Sands Street, Hong Kong.",22.282804,114.130531,14/12/2012
WAN CHAI,22/06/2013,03/12/2012,"HONGKONG TRAMWAYS, LIMITED",GW-RS1221-12,"Tram track between Kennedy Town and Shau Kei Wan, Hong Kong",22.278746,114.2286476,23/12/2012
WAN CHAI,05/06/2013,27/11/2012,Chun Wo-CRGL Joint Venture,GW-RS1223-12,"An area near Great Eagle Centre, an area near Harbour Centre and an area beside WSD Salt Water Pumping Station, Wan Chai, Hong Kong",22.276022,114.1751471,07/12/2012
WAN CHAI,29/05/2013,30/11/2012,Chun Wo - CRGL Joint Venture,GW-RS1228-12,"A section of Hung Hing Road near Wan Shing Street and a section of Marsh Road near Hung Hing Road, Wan Chai, Hong Kong",22.282835,114.179813,30/11/2012
EASTERN,25/05/2013,28/11/2012,Chun Wo - CRGL - MBEC Joint Venture,GW-RS1230-12,"North Point New Reclamation Area - Portion VII (Section of Watson Road), HK",22.396428,114.109497,28/11/2012
EASTERN,24/06/2013,07/12/2012,"HONGKONG TRAMWAYS, LIMITED",GW-RS1237-12,"Tram track between Kennedy Town and Shau Kei Wan, Hong Kong",22.278746,114.2286476,25/12/2012
WAN CHAI,29/05/2013,30/11/2012,Chun Wo - CRGL Joint Venture,GW-RS1243-12,"Victoria Harbour near Hung Hing Road, Wan Chai, Hong Kong",22.282835,114.179813,05/12/2012
CENTRAL AND WESTERN,11/06/2013,30/11/2012,BUDA Pipe Rehabilitation & Engineering Co. Ltd.,GW-RS1244-12,"Man Kwong Street, Man Yiu Street & Harbour View Street, Central, Hong Kong",22.284593,114.157724,13/12/2012
WAN CHAI,05/06/2013,05/12/2012,CHUN WO - CRGL JOINT VENTURE,GW-RS1245-12,"A section of Expo Drive East near Expo Drive, Wan Chai, HK",22.283176,114.171878,06/12/2012
SOUTHERN,02/06/2013,05/12/2012,LEIGHTON CONTRACTORS (ASIA) LIMITED,GW-RS1251-12,"Wong Chuk Hang Nullah (The Section of Area Next to Operational Fitness Training Area of Police School), Wong Chuk Hang, Hong Kong.",22.239055,114.1706884,09/12/2012
ISLANDS,28/05/2013,29/11/2012,CHINA STATE CONSTRUCTION ENGINEERING (HONG KONG) LIMITED,GW-RS1252-12,Construction Site of Hong Kong-Zhuhai-Macao Bridge Hong Kong Link Road - Section between Scenic Hill and Hong Kong Boundary Crossing Facilities (Contract No.: HY/2011/03),-1,-1,29/11/2012
WAN CHAI,31/05/2013,30/11/2012,CRBC - WCCL JV,GW-RS1253-12,"A section of Gloucester Road and Victoria Park Road near Cleveland Street and a section of Cleveland Street near Gloucester Road, Causeway Bay, HK",22.280703,114.179064,07/12/2012
ISLANDS,28/06/2013,10/12/2012,"PAUL Y. CONSTRUCTION CO., LTD.",GW-RS1264-12,"Lamma Power Station, Lamma Island (Contract no.: 11/8012)",-1,-1,29/12/2012
CENTRAL AND WESTERN,24/05/2013,30/11/2012,HIP HING ENGINEERING COMPANY LIMITED,GW-RS1265-12,"150–162 Belcher’s Street and 1–9 Kwan Yick Street, Hong Kong.",22.282337,114.126587,03/12/2012
SOUTHERN,18/06/2013,11/12/2012,MERSING (HK) TRENCHLESS LIMITED,GW-RS1266-12,"Site Area opposite to Sewage Screening Plant, Tin Wan Praya Road, Tin Wan, Hong Kong (DSD Contract No. DC/2008/09)",-1,-1,20/12/2012
SOUTHERN,06/06/2013,12/12/2012,Leighton - LNS Joint Venture,GW-RS1268-12,"Site Area near Dairy Farm Ice and Cold Storage, Tin Wan Praya Road, Tin Wan, Hong Kong (DSD Contract No. DC/2007/24)",-1,-1,07/12/2012
SOUTHERN,06/06/2013,12/12/2012,Leighton - LNS Joint Venture,GW-RS1269-12,"Site Area near Dairy Farm Ice and Cold Storage, Tin Wan Praya Road, Tin Wan, Hong Kong (DSD Contract No. DC/2007/24)",-1,-1,07/12/2012
CENTRAL AND WESTERN,31/05/2013,06/12/2012,GAMMON BUILDING CONSTRUCTION LIMITED,GW-RS1270-12,"The Forum, Harbour View Street, Central, Hong Kong.",22.284593,114.157724,10/12/2012
WAN CHAI,26/05/2013,04/12/2012,Chun Wo - CRGL Joint Venture,GW-RS1272-12,"An area near Hung Hing Road, Wan Chai, HK",22.500083,114.129879,05/12/2012
ISLANDS,17/06/2013,17/12/2012,GAMMON CONSTRUCTION LIMITED,GW-RS1291-12,"Hong Kong International Airport, Outlying Island, NT",22.396428,114.109497,17/12/2012
WAN CHAI,09/06/2013,10/12/2012,Chun Wo - Leader Joint Venture,GW-RS1293-12,"Two sections of Fleming Road near Harbour Road, Wan Chai, HK",22.280663,114.17431,10/12/2012
CENTRAL AND WESTERN,29/06/2013,12/12/2012,HIP HING CONSTRUCTION COMPANY LIMITED,GW-RS1300-12,"Pacific Place, 88 Queensway, Hong Kong.",22.277722,114.16481,02/01/2013
CENTRAL AND WESTERN,29/06/2013,12/12/2012,Win Win Way Construction Co. Ltd.,GW-RS1301-12,"10 Hollywood Road, Central Police Station Compound, Central, Hong Kong.",22.281772,114.154135,02/01/2013
CENTRAL AND WESTERN,09/07/2013,12/12/2012,Gammon Construction Limited,GW-RS1303-12,"18-22 Castle Road, 92-102 Caine Road, Hong Kong.",22.281944,114.151372,10/01/2013
SOUTHERN,18/06/2013,19/12/2012,Leighton - John Holland Joint Venture,GW-RS1307-12,"Yi Nam Road, Ap Lei Chau, Hong Kong (South Island Line (East) Contract 904)",22.242879,114.148815,19/12/2012
ISLANDS,19/06/2013,20/12/2012,UNION CONTRACTORS LTD.,GW-RS1314-12,"Hong Kong International Airport, Chek Lap Kok. (Contract No.  M172-2)",-1,-1,20/12/2012
ISLANDS,12/06/2013,13/12/2012,Gammon Construction Limited,GW-RS1315-12,"Outlying Island, NT",-1,-1,13/12/2012
SOUTHERN,25/06/2013,19/12/2012,CRBC - WCCL JV,GW-RS1316-12,"Shum Wan Road, Wong Chuk Hang, Hong Kong.",22.241323,114.166264,26/12/2012
EASTERN,30/06/2013,18/12/2012,SHINRYO (HONG KONG) LIMITED,GW-RS1319-12,The MTRC Tunnel from Causeway Bay Station to Fortress Hill Station,-1,-1,01/01/2013
WAN CHAI,30/06/2013,21/12/2012,WAI KEE (ZENS) CONSTRUCTION & TRANSPORTATION CO. LTD.,GW-RS1320-12,"A section of Leighton Road near Tung Lo Wan Road and Irving Street & a section of Tung Lo Wan Road near Leighton Road, Causeway Bay, HK",-1,-1,01/01/2013
ISLANDS,14/06/2013,14/12/2012,CHINA STATE CONSTRUCTION ENGINEERING (HONG KONG) LIMITED,GW-RS1321-12,Site Office of Hong Kong-Zhuhai-Macau Bridge Hong Kong Link Road - Section between Scenic Hill and Hong Kong Boundary Crossing Facilities (Contract No.: HY/2011/03),-1,-1,15/12/2012
CENTRAL AND WESTERN,11/06/2013,14/12/2012,CHINA STATE CONSTRUCTION ENGINEERING (HONG KONG) LIMITED,GW-RS1324-12,"64-66A Bonham Road, Mid-levels West, HK",22.28408,114.143402,17/12/2012
EASTERN,17/06/2013,18/12/2012,Gammon Construction Limited,GW-RS1325-12,"Victoria Park Near Hing Fat Street, North Point, HK",22.28542,114.190696,18/12/2012
WAN CHAI,22/06/2013,17/12/2012,"RAY ON CONSTRUCTION CO., LTD.",GW-RS1327-12,"Times Square, Wan Chai, HK",22.278151,114.181706,23/12/2012
CENTRAL AND WESTERN,30/06/2013,17/12/2012,THYSSENKRUPP ELEVATOR (HK) LIMITED,GW-RS1330-12,"Central - Mid-Levels Escalator (Junction of  Des Voeux Road Central and Queen Victoria Street AND Section between Queen's Road Central and Wellinton Street), Hong Kong.",-1,-1,01/01/2013
ISLANDS,30/06/2013,20/12/2012,SHUN YUEN CONSTRUCTION CO. LTD.,GW-RS1336-12,"Southern Runway, Northern Runway and Taxiways, Hong Kong International Airport, Chek Lap Kok (Airport Civil Works Contract M241)",-1,-1,01/01/2013
WAN CHAI,23/06/2013,24/12/2012,Sun Fook Kong (Civil) Ltd,GW-RS1337-12,"A section of Bowrington Road near Hennessy Road, Wan Chai, Hong Kong",22.277917,114.176491,28/12/2012
CENTRAL AND WESTERN,14/06/2013,20/12/2012,KML ENGINEERING LIMITED,GW-RS1340-12,"MTR Central Station, Chater Road, Central, HK",22.2799907,114.1587983,24/12/2012
ISLANDS,19/07/2013,21/12/2012,KONWALL CONSTRUCTION & ENGINEERING CO. LTD.,GW-RS1341-12,"TCTL36, Area 55A, Tung Chung, Lantau Island, NT",-1,-1,20/01/2013
WAN CHAI,25/06/2013,20/12/2012,China State Construction Engineering (Hong Kong) Ltd.,GW-RS1342-12,"The basin near Hung Hing Road, Causeway Bay, Hong Kong",22.282835,114.179813,26/12/2012
EASTERN,31/05/2013,19/12/2012,EXCEL ENGINEERING COMPANY LIMITED,GW-RS1343-12,"King's Road between Finnie Street and Pan Hoi  Street, Quarry Bay, HK",22.286334,114.212308,31/12/2012
CENTRAL AND WESTERN,14/06/2013,20/12/2012,GAMMON-NISHIMATSU WIL JOINT VENTURE,GW-RS1351-12,"Whitty Street Public Toilet, Junction of Queen's Road West and Whitty Street, Sai Ying Pun, Hong Kong (Shaft)",-1,-1,22/12/2012
WAN CHAI,23/06/2013,24/12/2012,SUN FOOK KONG (CIVIL) LTD,GW-RS1354-12,"A section of Hennessy Road near Lee Garden Road, Causeway Bay, HK",22.278904,114.183643,27/12/2012
CENTRAL AND WESTERN,23/06/2013,24/12/2012,SUN FOOK KONG (CIVIL) LTD,GW-RS1355-12,"110-124 Connaught Road Central and Rumsey Street, Sheung Wan, Hong Kong.",22.28682,114.153557,28/12/2012
CENTRAL AND WESTERN,19/06/2013,21/12/2012,CHINA STATE CONSTRUCTION ENGINEERING (HONG KONG) LIMITED,GW-RS1356-12,"Outside Queensway Government Office, 66 Queensway, Hong Kong.",22.396428,114.109497,21/12/2012
ISLANDS,20/06/2013,21/12/2012,CHINA HARBOUR ENGINEERING CO. LTD.,GW-RS1360-12,Construction Site of Hong Kong-Zhuhai-Macao Bridge Hong Kong Boundary Crossing Facilities - Reclamation Works (Contract No.: HY/2010/02),-1,-1,21/12/2012
CENTRAL AND WESTERN,22/06/2013,24/12/2012,Sun Fook Kong (Civil) Limited,GW-RS1361-12,"Section of Belcher's Street near Holland Street, Kennedy Town, Hong Kong.",22.284642,114.130684,27/12/2012
WAN CHAI,23/06/2013,24/12/2012,SUN FOOK KONG (CIVIL) LTD,GW-RS1365-12,"Junction of Lee Garden Road and Pak Sha Road, Causeway Bay, HK",22.278904,114.183643,27/12/2012
ISLANDS,17/07/2013,24/12/2012,"WING HING CONSTRUCTION CO., LTD.",GW-RS1366-12,"Hong Kong International Airport, Outlying Island, NT",22.396428,114.109497,18/01/2013
EASTERN,27/05/2013,24/12/2012,EXCEL ENGINEERING COMPANY LIMITED,GW-RS1370-12,"Wan Tsui Road near Chak Tsui House of Wan Tsui Estate, Chai Wan, HK",22.2678103,114.2360778,28/12/2012
EASTERN,30/06/2013,24/12/2012,ANDERSON CONCRETE LIMITED,GW-RS1372-12,"SAFETY GODOWN INDUSTRIAL BUILDING, CHAI WAN INLAND LOT 112 AND 115, CHAI WAN, HONG KONG",22.2678103,114.2360778,01/01/2013
ISLANDS,07/06/2013,03/01/2013,GAMMON CONSTRUCTION LIMITED,GW-RS1376-12,"Hong Kong International Airport, Outlying Island, NT",22.396428,114.109497,07/01/2013
SOUTHERN,07/07/2013,02/01/2013,CRBC - WCCL JV,GW-RS1377-12,"South Bay Close near Hong Kong International School, Repulae Bay, Hong Kong (Highways Department Contract No. 04/HY/2010)",22.396428,114.109497,08/01/2013
CENTRAL AND WESTERN,28/06/2013,24/12/2012,DRAGAGES-MAEDA-BSG  J.V.,GW-RS1379-12,"Des Voeux Road West and Tsz Mi Alley, Sai Ying Pun, Hong Kong (MTR West Island Line)",-1,-1,31/12/2012
ISLANDS,07/07/2013,27/12/2012,CLP ENGINEERING LIMITED,GW-RS1380-12,"Airport Road, Chek Lap Kok, Hong Kong.",22.308253,113.937516,13/01/2013
WAN CHAI,07/07/2013,31/12/2012,Chun Wo - CRGL Joint Venture,GW-RS1381-12,"Victoria Harbour near Hung Hing Road, Wan Chai, Hong Kong",22.282835,114.179813,09/01/2013
CENTRAL AND WESTERN,30/06/2013,02/01/2013,LEIGHTON CONTRACTORS (ASIA) LIMITED,GW-RS1382-12,"Man Kwong Street and Man Chiu Street, Central, Hong Kong.",22.287028,114.158073,04/01/2013
EASTERN,30/08/2013,28/12/2012,SHINRYO (HONG KONG) LIMITED,GW-RS1383-12,"Track Side between MTRC Sai Wan Ho Station to MTRC Heng Fa Chuen Station, Hong Kong",22.276666,114.239701,01/03/2013
WAN CHAI,16/07/2013,31/12/2012,Chun Wo -CRGL Joint Venture,GW-RS1384-12,"Victoria Harbour near the Ferry Pier in Convention Avenue, Wan Chai, HK",22.281731,114.174282,17/01/2013
WAN CHAI,09/07/2013,03/01/2013,Yick Hing Construction Co. Ltd.,GW-RS1385-12,"A section of Queen's Road East between Anton Street and Monmunt Path, Wan Chai, HK",22.276022,114.1751471,10/01/2013
WAN CHAI,13/06/2013,02/01/2013,MING HING WATERWORKS ENGINEERING CO LTD,GW-RS1387-12,"Three sections of Percival Street near Russell Street, Causeway Bay, HK",22.27894,114.182859,14/01/2013
TUEN MUN,30/06/2013,02/01/2013,CHINA STATE CONSTRUCTION ENGINEERING (HK) LIMITED,GW-RW0001-13,"Tai Lam Section: Eastbound CH57.8B - CH59.51B Slow Lane, Tuen Mun Road - Tai Lam Section, N.T.",-1,-1,01/01/2013
SHAM SHUI PO,08/07/2013,02/01/2013,SUN FOOK KONG (CONSTRUCTION) LTD,GW-RW0002-13,Lai Chi Kok MTR Station Concourse Level,-1,-1,09/01/2013
KWAI TSING,26/05/2013,04/01/2013,Shun Yuen Construction Co Ltd,GW-RW0004-13,"Tai Wo Hau Road, Kwai Chung, NT",22.366289,114.125771,20/01/2013
KWAI TSING,07/07/2013,10/01/2013,CLP ENGINEERING LIMITED,GW-RW0010-13,"Tsing Sheung Road, Tsing Yi, N.T.",22.32897,114.109828,13/01/2013
TSUEN WAN,30/06/2013,02/01/2013,CHIU HING CONSTRUCTION AND TRANSPORTATION COMPANY LIMITED,GW-RW0011-13,"Cheung Pei Shan Road, Tsuen Wan West, NT",22.375943,114.121776,01/01/2013
TSUEN WAN,17/07/2013,07/01/2013,GAMMON CONSTRUCTION LIMITED,GW-RW0012-13,"Junction of Hoi Hing Road and Hoi Kok Street, Tsuen Wan, N.T.",22.371391,114.106807,18/01/2013
SHAM SHUI PO,30/09/2013,04/01/2013,YEE HOP ENGINEERING CO LTD,GW-RW0013-13,"Lai Po Road near KMB Lai Chi Kok Depot, Stonecutters Island, Kowloon",22.3228031,114.1350173,01/04/2013
TSUEN WAN,10/07/2013,11/01/2013,LEIGHTON CONTRACTORS (ASIA) LIMITED,GW-RW0015-13,"Junction of Cheung Wing Road and Yau Ma Hom Road, Tsuen Wan, NT.(XRL-Shek Yam Construction Adit Work Area)",-1,-1,11/01/2013
TSUEN WAN,12/07/2013,10/01/2013,Excel Engineering Company Limited,GW-RW0016-13,"Ma Kok Street near Tsuen Yip Street, Tsuen Wan, N.T.",22.364834,114.119675,13/01/2013
TUEN MUN,04/08/2013,17/01/2013,CHINA HARBOUR ENGINEERING CO LIMITED,GW-RW0018-13,"Tuen Mun Road CH56.2 - CH51.3, Tuen Mun, N.T.",-1,-1,10/02/2013
SHAM SHUI PO,29/06/2013,14/01/2013,Siemens Limited,GW-RW0021-13,"Elite Industrial Centre, 883 Cheung Sha Wan Road, Cheung Sha Wan, Kowloon",22.336711,114.147572,01/02/2013
KWAI TSING,08/07/2013,11/01/2013,WO HING CONSTRUCTION CO; LTD,GW-RW0023-13,"Kwai Fung Crescent, Kwai Chung, NT",-1,-1,09/01/2013
TSUEN WAN,13/07/2013,11/01/2013,EXCEL ENGINEERING COMPANY LIMITED,GW-RW0025-13,"Ma Kok Lane,  Tsuen Wan, N.T.",22.365017,114.11627,14/01/2013
KWAI TSING,22/07/2013,17/01/2013,W. HING CONSTRUCTION CO. LTD,GW-RW0037-13,"403-413 Castle Peak Road - Kwai Chung, Kwai Chung, NT",22.3640501,114.1357637,23/01/2013
SHAM SHUI PO,31/07/2013,17/01/2013,Sun Fook Kong - Biwater Joint Venture,GW-RW0038-13,"Stonecutters Island Sewage Treatment Works, Stonecutters Island, Kowloon",22.3228031,114.1350173,01/02/2013
SHAM SHUI PO,30/06/2013,18/01/2013,UNION CONSTRUCTION (GROUP) LIMITED,GW-RW0039-13,"Innocentre, Shek Kip Mei, Kowloon",22.3360236,114.1662297,15/02/2013
KWAI TSING,17/07/2013,22/01/2013,Excel Engineering Company Limited,GW-RW0046-13,"Contract No. 13/WSD/10 - Replacement and Rehabilitation of Water Mains, Stage 4 Phase 1 :Tsing Yi Road, Tsing Yi, N.T.",-1,-1,18/01/2013
TSUEN WAN,27/07/2013,21/01/2013,Dragages - China Harbour - VSL Joint Venture,GW-RW0047-13,"Construction Site of Hong Kong-Zhuhai-Macao Bridge, Hong Kong Link Road Section Between HKSAR Boundary and Scenic Hill, Works Area WA4B (Contract No.: HY/2011/09)",-1,-1,28/01/2013
SHAM SHUI PO,23/07/2013,23/01/2013,"HSIN CHONG CONSTRUCTION CO., LTD",GW-RW0048-13,"Cheung Sha Wan, Kowloon",22.3367376,114.1528532,24/01/2013
KWAI TSING,31/07/2013,24/01/2013,ANDERSON CONCRETE LIMITED,GW-RW0050-13,"TYTL 119, Tam Kon Shan Road, Tsing Yi, NT. NT",-1,-1,01/02/2013
KWAI TSING,20/07/2013,25/01/2013,China Harbour Engineering Company Limited,GW-RW0051-13,"Container Terminal No. 2 & 5, Kwai Chung, NT",-1,-1,28/01/2013
TUEN MUN,24/07/2013,28/01/2013,CHINA STATE CONSTRUCTION ENG (H.K.) LTD.,GW-RW0052-13,"So Kwun Wat Road, So Kwun Wat, Tuen Mun, N.T.",22.375283,113.99875,25/01/2013
SHAM SHUI PO,31/07/2013,23/01/2013,Sun Fook Kong - Biwater Joint Venture,GW-RW0053-13,"Stonecutters Island Sewage Treatment Works, Stonecutters Island, Kowloon",22.3228031,114.1350173,01/02/2013
TSUEN WAN,24/07/2013,23/01/2013,CHINA STATE CONSTRUCTION ENGINEERING (HK) LIMITED,GW-RW0054-13,"Construction Site of Hong Kong-Zhuhai-Macao Bridge, Hong Kong Link Road - Section between HKSAR Boundary and Scenic Hill, Works Area WA4C",-1,-1,25/01/2013
SHAM SHUI PO,27/07/2013,30/01/2013,PAUL Y. CONSTRUCTION COMPANY LIMITED,GW-RW0056-13,"J/O Hoi Fai Road & Sham Mong Road, Sham Shui Po, Kowloon",22.323712,114.159002,30/01/2013
TSUEN WAN,31/07/2013,28/01/2013,GAMMON CONSTRUCTION LIMITED.,GW-RW0057-13,"Contract No. HY/2007/09 – Reconstruction and Improvement of Tuen Mun Road – Eastern Section, Tuen Mun Road Chainage between CH60.0 to CH62.8 Eastbound and Westbound All Lanes, Tsuen Wan, N.T.",-1,-1,01/02/2013
TSUEN WAN,01/10/2013,25/01/2013,PCCL JOINT VENTURE,GW-RW0061-13,"Footbridge no. NF109 across Castle Peak Road near Fou Wah Centre, Tsuen Wan, N.T.",-1,-1,01/04/2013
TSUEN WAN,11/08/2013,06/02/2013,MAEDA-CRGL-SELI JOINT VENTURE,GW-RW0063-13,"CASTLE PEAK ROAD - TING KAU SECTION BESIDE GREENVIEW TERRACE, TSUEN WAN, N.T.",-1,-1,12/02/2013
SHAM SHUI PO,31/05/2013,30/01/2013,Leighton - John Holland Joint Venture,GW-RW0064-13,"Construction site between Ching Cheung Road, Butterfly Valley Road and King Lam Street, Kowloon",-1,-1,01/02/2013
TUEN MUN,31/07/2013,30/01/2013,CHINA STATE CONSTRUCTION ENGINEERING (HK) LIMITED,GW-RW0065-13,"Route 9, Tuen Mun Road CH56.0 - CH62.2 (from Siu Lam to Tsing Lung Tau ), Both Bound, Tuen Mun, NT",-1,-1,01/02/2013
KWAI TSING,31/05/2013,05/02/2013,Shun Yuen Construction Company Limited,GW-RW0067-13,"Tsing Yi Road (S/B, section between Tsing Yi Interchange and Ching Hong Road), Tsing Yi, N.T.",-1,-1,25/02/2013
KWAI TSING,02/06/2013,04/02/2013,Shun Yuen Construction Company Limited,GW-RW0068-13,"Kwai Shing Circuit (Section Between L/P No.FA9835 AND FA9832),Kwai Chung, N.T.",-1,-1,28/02/2013
TSUEN WAN,12/08/2013,04/02/2013,MAEDA-CRGL-SELI JOINT VENTURE,GW-RW0071-13,"Construction Site near Tsuen Wan West High Level Sea Water Service Reservoir, Tso Kung Tam, Tsuen Wan, New Territories",22.3777238,114.1052893,13/02/2013
TSUEN WAN,31/05/2013,05/02/2013,Shun Yuen Construction Company Limited,GW-RW0074-13,"Shing Mun Road, Tsuen Wan West, NT",-1,-1,18/02/2013
TSUEN WAN,25/05/2013,04/02/2013,GAMMON CONSTRUCTION LTD,GW-RW0075-13,"Tuen Mun Road Chainage Ch64.5 - Ch66.9 Eastbound and Chainage Ch64.95 - Ch66.9 Westbound, Yau Kom Tau, Tsuen Wan, N.T.",-1,-1,20/02/2013
KWAI TSING,31/05/2013,29/01/2013,Shun Yuen Construction Company Limited,GW-RW0076-13,"Kwai Chung Road near Lai King Hill Road, Kwai Chung, NT",-1,-1,25/02/2013
TUEN MUN,18/08/2013,05/02/2013,CHINA HARBOUR ENGINEERING CO LIMITED,GW-RW0077-13,"Tuen Mun, NT",-1,-1,24/02/2013
KWAI TSING,31/05/2013,31/01/2013,Shun Yuen Construction Company Limited,GW-RW0078-13,"Container Port Road South between Roundabout No. 5 and Tat Mei Road, Kwai Chung, NT",-1,-1,25/02/2013
TUEN MUN,29/07/2013,04/02/2013,China Harbour Engineering Company Limited,GW-RW0079-13,"Tuen Mun Road, Tuen Mun, N.T. (Contract No.: HY/2009/03 - Design & Build of Traffic Improvements to Tuen Mun Road Town Centre Section).",-1,-1,02/02/2013
