district,end_date,issued_on,permittee_name,permit_no,address,lat,lng,start_date
SHA TIN,31/05/2013,04/12/2012,GAMMON CONSTRUCTION LTD,GW-RN0571-12,"Lion Rock Tunnel Road, South Bound, Ch16.415, Slip Road to Hung Mui Kuk Road, Full Width,  Shatin, N.T.",-1,-1,17/12/2012
TAI PO,07/06/2013,03/12/2012,China Road and Bridge Corporation and DIX Construction & Transportation Ltd Joint Venture,GW-RN0573-12,"Pak Shing Street and Fing Kok Road(between Tai Po Tai Wo Road and Kwong Fuk Road), Tai Po, N.T.",-1,-1,08/12/2012
YUEN LONG,17/06/2013,22/11/2012,Maeda -- China State Joint Venture,GW-RN0577-12,Construction site of Express Rail Link – Shek Kong Stabling Sidings & Emergency Rescue Siding (Contract No. 823B),-1,-1,18/12/2012
YUEN LONG,19/06/2013,27/11/2012,Yee Hop Engineering Company Limited,GW-RN0580-12,"Kam Tai Road near Kam Tin Road, Kam Tin, Yuen Long, New Territories",22.440047,114.058296,20/12/2012
SHA TIN,31/05/2013,26/11/2012,Chun Wo Construction & Engineering Company Limited,GW-RN0583-12,"Tai Po Road - Sha Tin near Sheung Wo Che, Shatin, N.T. (WSD Contract No.: 15/WSD/08)",-1,-1,01/12/2012
YUEN LONG,03/06/2013,29/11/2012,Leighton Contractors (Asia) Limited,GW-RN0585-12,Construction site at Tse Uk Tsuen of Express Rail Link – Tse Uk Tsuen to Shek Yam Tunnels (Contract No. 822),-1,-1,04/12/2012
TAI PO,02/06/2013,30/11/2012,"Able Engineering Co., Limited",GW-RN0586-12,"Tsz Shan Monastery, North of San Tau Kok Village T.P.T.L. 198 Tai Po, NT, Tung Tsz Road",-1,-1,03/12/2012
SHA TIN,05/06/2013,07/12/2012,Hsin Chong Construction Company Limited,GW-RN0588-12,"Shatin Area 4C, Heung Fan Liu Street, Tai Wai, Shatin, NT",-1,-1,06/12/2012
SHA TIN,08/06/2013,30/11/2012,Lam Woo & Company Limited,GW-RN0589-12,"Sui Wo Road outside Sui Wo Court Phase 1 & 2 and Fo Tan Pumping Station, Fo Tan, Shatin, N.T. (Water Supplies Department Contract No.: 20/WSD/06)",-1,-1,09/12/2012
SHA TIN,20/06/2013,10/12/2012,MTR Corporation Limited,GW-RN0590-12,MTR Ma On Shan Line from Tai Wai Station to Wu Kai Sha Station,-1,-1,21/12/2012
YUEN LONG,04/06/2013,06/12/2012,"Penta-Ocean Construction Co., Ltd.",GW-RN0600-12,"Construction site of MTRC Express Rail Link (Contract No. 825) at Wo Shang Wai, Mai Po, Yuen Long, New Territories",22.498766,114.0458275,11/12/2012
TAI PO,28/05/2013,24/12/2012,Gammon Construction Limited,GW-RN0602-12,"Fanling Highway between Lam Kam Road Interchange and Hong Lok Yuen Road, Tai Po, N.T. (Widening of Tolo Highway / Fanling Highway, Stage 1, Contract No. HY/2009/08)",-1,-1,18/12/2012
SHA TIN,31/05/2013,21/12/2012,GAMMON CONSTRUCTION LTD,GW-RN0604-12,"Tsing Sha Highway, South Bound, Ch33.07 to Ch32.275, Full Width,  Shatin, N.T.",-1,-1,27/12/2012
YUEN LONG,11/06/2013,12/12/2012,K H Foundations Limited,GW-RN0611-12,"Public Library and Indoor Recreation Centre in Area 3, Yuen Long, N.T.",-1,-1,12/12/2012
SHA TIN,28/06/2013,24/12/2012,Paul Y. Builders Limited,GW-RN0612-12,"Trackside near Chik Wan Street and Tai Wai Depot, MTR East Rail Line, Shatin, N.T.",-1,-1,29/12/2012
SHA TIN,31/07/2013,24/12/2012,Sun Fook Kong Construction Limited and Sun Fook Kong (Civil) Limited,GW-RN0613-12,"Che Kung Temple MTR Station, Ma On Shan Line, Shatin, NT",-1,-1,01/02/2013
TAI PO,30/06/2013,17/12/2012,China Harbour Engineering Company Limited,GW-RN0614-12,"Tai Po Sewage Treatment Works,Dai Kwai Street,Tai Po Sewage Treatment Works",-1,-1,01/01/2013
SHA TIN,12/06/2013,28/12/2012,Chun Wo Construction & Engineering Co Ltd,GW-RN0615-12,"Lion Rock Tunnel Road at south bound and north bound from CH15.0 to CH17.6 (Lion Rock Tunnel to Shatin Road), Shatin, N.T.",-1,-1,13/12/2012
YUEN LONG,30/06/2013,20/12/2012,Maeda-China State Joint Venture,GW-RN0616-12,Construction site of Express Rail Link – Shek Kong Stabling Sidings & Emergency Rescue Siding (Contract No. 823B),-1,-1,31/12/2012
NORTH DISTRICT,27/06/2013,19/12/2012,Maeda Corporation,GW-RN0619-12,"MTR Sheung Shui Station, Sheung Shui, New Territories (MTR Contract No.: K0716-11C)",22.501257,114.127945,28/12/2012
SHA TIN,30/06/2013,28/12/2012,Lam Woo & Company Limited,GW-RN0620-12,"Near junction of Ngan Shing Street and Chap Wai Kon Street, Sha Tin, N.T. (Water Supplies Department Contract No.: 20/WSD/06)",-1,-1,01/01/2013
YUEN LONG,20/06/2013,11/12/2012,Hip Hing Engineering Co. Ltd.,GW-RN0623-12,"Lot 419 in DD127, Tai Tao Tsuen, Hung Shui Kiu,  Yuen Long, NT",-1,-1,21/12/2012
YUEN LONG,20/06/2013,24/12/2012,Waking Builders Ltd.,GW-RN0626-12,"Yuen Long, NT",-1,-1,21/12/2012
TAI PO,26/06/2013,21/12/2012,Gammon Construction Limited,GW-RN0627-12,"Tai Po Tai Wo Road, Tai Po, New Territories, (Widening of Tolo Highway / Fanling Highway, Stage 1, Contract No. HY/2009/08)",-1,-1,27/12/2012
YUEN LONG,20/06/2013,20/12/2012,Gammon Construction Limited,GW-RN0629-12,"Hung Shui Kiu Area 13 Phase 1, 2 and 3",-1,-1,20/12/2012
YUEN LONG,20/06/2013,24/12/2012,Leighton Contractors (Asia) Ltd.,GW-RN0631-12,Construction site at Pat Heung of Express Rail Link – Tse Uk Tsuen to Shek Yam Tunnels (Contract No. 822),-1,-1,27/12/2012
TAI PO,30/06/2013,24/12/2012,China Road and Bridge Corporation and DIX Construction & Transportation Ltd Joint Venture,GW-RN0635-12,"Tai Po, NT",-1,-1,31/12/2012
SHA TIN,18/06/2013,28/12/2012,Lam Woo & Company Limited,GW-RN0638-12,"Pai Tau Street near Sheung Wo Che Road and Sha Tin Rural Committee Road ,  Sha Tin, N.T. (Water Supplies Department Contract No.: 20/WSD/06)",-1,-1,19/12/2012
NORTH DISTRICT,27/06/2013,21/12/2012,Maeda Corporation,GW-RN0640-12,"MTRC Fanling Station, Fanling, N.T.",-1,-1,28/12/2012
YUEN LONG,30/06/2013,27/12/2012,Hsin Chong Construction Company Limited,GW-RN0644-12,"Hung Shui Kiu, Area 13, Phase 1 and 2, Yuen Long, NT",-1,-1,01/01/2013
SHA TIN,08/07/2013,07/01/2013,"Junic Construction Co., Ltd.",GW-RN0646-12,"MTR Che Kung Temple Station, Tai Wai, N.T.",22.37476,114.185953,09/01/2013
TAI PO,30/06/2013,24/12/2012,China Road and Bridge Corporation and DIX Construction & Transportation Ltd Joint Venture,GW-RN0647-12,"FU SHIN ESTATE, YEE NGA COURT, NAM WAN ROAD NEAR YEE NGAI COURT, TAI PO NT",-1,-1,31/12/2012
WAN CHAI,03/07/2013,02/01/2013,SUN FOOK KONG (CIVIL) LTD,GW-RS0001-13,"A section of Percival Street near Russell Street, Causeway Bay, HK",22.27894,114.182859,13/01/2013
CENTRAL AND WESTERN,30/06/2013,03/01/2013,CHINA STATE CONSTRUCTION ENGINEERING (HONG KONG) LIMITED,GW-RS0002-13,"5 Connaught Road Central, Central, Hong Kong",22.281906,114.159393,06/01/2013
WAN CHAI,07/06/2013,07/01/2013,EXCEL ENGINEERING COMPANY LIMITED,GW-RS0003-13,"Two sections of Harbour Road near Fleming Road, Wan Chai, HK",22.27921,114.174624,10/01/2013
CENTRAL AND WESTERN,26/06/2013,04/01/2013,SUN FOOK KONG (CIVIL) LTD,GW-RS0005-13,"31-55 Des Voeux Road Central, Central, Hong Kong",22.2829262,114.1571368,07/01/2013
WAN CHAI,30/06/2013,04/01/2013,CRBC - WCCL JV,GW-RS0006-13,"A section of Gloucester Road to Cross Harbour Tunnel, Wan Chai, HK",22.2811485,114.1802805,15/01/2013
CENTRAL AND WESTERN,26/06/2013,04/01/2013,SUN FOOK KONG (CIVIL) LIMITED,GW-RS0008-13,"Jubilee Street (outside Hang Seng Bank Headquarters), Central, Hong Kong",22.2799907,114.1587983,07/01/2013
SOUTHERN,31/07/2013,11/01/2013,CRBC - WCCL JOINT VENTURE,GW-RS0011-13,"Ap Lei Chau Bridge Road near Children’s Playground, Wong Chuk Hang, Hong Kong (Highways Department Contract No. 04/HY/2010)",22.2418581,114.1528532,01/02/2013
EASTERN,22/05/2013,09/01/2013,EXCEL ENGINEERING COMPANY LIMITED,GW-RS0012-13,"Island Western Corridor near Healthy Street West, North Point, HK",22.291979,114.204484,23/01/2013
EASTERN,27/06/2013,08/01/2013,Chun Wo - CRGL - MBEC Joint Venture,GW-RS0013-13,"North Point New Reclamation Area - Portion III (Near Oil Street And City Garden), Hong Kong",22.290147,114.19372,28/12/2012
EASTERN,22/07/2013,08/01/2013,PAUL Y. GENERAL CONTRACTORS LIMITED,GW-RS0014-13,"Urban Renewal Project (H21) at Shau Kei Wan I.L. No. 850, Shau Kei Wan Road / Nam On Street, Hong Kong",22.396428,114.109497,23/01/2013
WAN CHAI,07/06/2013,07/01/2013,EXCEL ENGINEERING COMPANY LIMITED,GW-RS0015-13,"Three sections of Hennessy Road between Johnston Road and Luard Road, Wan Chai, HK",22.277599,114.171617,08/01/2013
CENTRAL AND WESTERN,13/07/2013,08/01/2013,Yick Hing Construction Co. Ltd.,GW-RS0017-13,"A section of Bowen Drive near Bowen Road Fresh Water Service Reservoir, Wan Chai, HK",22.276022,114.1751471,14/01/2013
EASTERN,08/07/2013,08/01/2013,GAMMON BUILDING CONSTRUCTION LIMITED,GW-RS0022-13,"Westlands Road, Taikoo Place, Quarry Bay, HK",-1,-1,09/01/2013
EASTERN,23/07/2013,14/01/2013,WAI CHEONG CONSTRUCTION ENGINEERING LIMITED,GW-RS0023-13,"King's Road near North View Street, North Point, Hong Kong.",22.290369,114.196694,24/01/2013
WAN CHAI,07/07/2013,04/01/2013,CHINA STATE CONSTRUCTION ENGINEERING (HONG KONG) LIMITED,GW-RS0028-13,"St Paul's Hospital, 2 Eastern Hospital Road, Causeway Bay, HK",22.2780243,114.1886476,10/01/2013
CENTRAL AND WESTERN,28/07/2013,14/01/2013,GAMMON-NISHIMATSU WIL JOINT VENTURE,GW-RS0031-13,"Former Hill Road Rest Garden O/T 17-25 Hill Road, Hong Kong",22.285875,114.135512,29/01/2013
SOUTHERN,17/07/2013,16/01/2013,Mersing (HK) Trenchless Limited,GW-RS0033-13,"Site Area near Sewage Treatment Plant, 50 Lee Nam Road, Ap Lei Chau, Hong Kong (DSD Contract No. DC/2008/09)",-1,-1,18/01/2013
WAN CHAI,10/06/2013,10/01/2013,EXCEL ENGINEERING COMPANY LIMITED,GW-RS0034-13,"Three sections of Johnston Road near Heard Street, Wan Chai, HK",22.277229,114.177372,13/01/2013
ISLANDS,13/07/2013,14/01/2013,CHINA STATE CONSTRUCTION ENGINEERING (HK) LIMITED,GW-RS0035-13,Construction Site of Hong Kong-Zhuhai-Macao Bridge Hong Kong Link Road - Section between Scenic Hill and Hong Kong Boundary Crossing Facilities (Contract No.: HY/2011/03),-1,-1,14/01/2013
ISLANDS,13/07/2013,14/01/2013,CHINA STATE CONSTRUCTION ENGINEERING (HK) LIMITED,GW-RS0037-13,Construction Site of Hong Kong-Zhuhai-Macao Bridge Hong Kong Link Road - Section between Scenic Hill and Hong Kong Boundary Crossing Facilities (Contract No.: HY/2011/03),-1,-1,14/01/2013
CENTRAL AND WESTERN,25/05/2013,16/01/2013,CHINA HARBOUR ENGINEERING COMPANY LIMITED,GW-RS0042-13,"Kellett Anchorage, Victoria Harbour, Hong Kong.",22.396428,114.109497,26/01/2013
WAN CHAI,30/06/2013,14/01/2013,EXCEL ENGINEERING COMPANY LIMITED,GW-RS0043-13,"Two sections of Wong Nai Chung Road near Queen's Road East, Wan Chai, Hong Kong",22.274503,114.173208,20/01/2013
WAN CHAI,10/06/2013,09/01/2013,EXCEL ENGINEERING COMPANY LIMITED,GW-RS0044-13,"Three sections of Hennessy Road between Stewart Road and Tonnochy Road, Wan Chai, Hong Kong",22.280265,114.177418,17/01/2013
CENTRAL AND WESTERN,31/05/2013,22/01/2013,BUDA Pipe Rehabilitation & Engineering Co. Ltd.,GW-RS0045-13,"Connaught Road Central (outside Mandarin Oriental Hotel), Central, Hong Kong.",22.2799907,114.1587983,28/01/2013
EASTERN,10/07/2013,18/01/2013,Chun Wo - CRGL - MBEC Joint Venture,GW-RS0046-13,"Island Eastern Corridor, North Point, HK",22.284183,114.221675,11/01/2013
WAN CHAI,31/05/2013,17/01/2013,EXCEL ENGINEERING COMPANY LIMITED,GW-RS0047-13,"Three sections of Leighton Road near Leighton Lane, Wan Chai, HK",22.277296,114.183797,21/01/2013
ISLANDS,20/07/2013,21/01/2013,CHINA STATE CONSTRUCTION ENGINEERING (HK) LIMITED,GW-RS0049-13,West Portal in the Construction Site of Hong Kong-Zhuihai-Macao Bridge Hong Kong Link Road - Section between Scenic Hill and Hong Kong Boundary Crossing Facilities (Contract No.: HY/2011/03),-1,-1,21/01/2013
WAN CHAI,19/07/2013,18/01/2013,Chun Wo - Leader Joint Venture,GW-RS0052-13,"Victoria Harbour between Wan Chai and Tsam sha Tsui, Hong Kong.",22.396428,114.109497,20/01/2013
SOUTHERN,16/07/2013,17/01/2013,Leighton - John Holland Joint Venture,GW-RS0053-13,"Lee Nam Road near Horizon Plaza, Ap Lei Chau, Hong Kong (South Island Line (East) Contract 904)",-1,-1,17/01/2013
EASTERN,22/05/2013,16/01/2013,EXCEL ENGINEERING COMPANY LIMITED,GW-RS0055-13,"Island Eastern Corridor near Tin Hau, North Point, Hong Kong",22.291278,114.198873,23/01/2013
WAN CHAI,12/07/2013,14/01/2013,Gammon - Leader Joint Venture,GW-RS0056-13,"Victoria Harbour near Lung King Street, Wan Chai, Hong Kong",22.2544,114.136457,16/01/2013
EASTERN,30/07/2013,18/01/2013,"THE JARDINE ENGINEERING CORPORATION, LIMITED",GW-RS0057-13,"Fortress Hill MTR Station, North Point, HK",22.287913,114.193661,01/02/2013
WAN CHAI,29/06/2013,16/01/2013,EXCEL ENGINEERING COMPANY LIMITED,GW-RS0058-13,"A section of Canal Road West near Gloucester Road, Wan Chai, HK",22.280703,114.179064,19/01/2013
WAN CHAI,26/05/2013,17/01/2013,CHUNG CHIN CONSTRUCTION & ENGINEERING CO. LTD.,GW-RS0059-13,"A section of Convention Avenue near the Hong Kong Convention and Exhibition Centre, Wan Chai, HK",22.283639,114.1732893,28/01/2013
CENTRAL AND WESTERN,24/07/2013,25/01/2013,CHINA ROAD AND BRIDGE CORPORATION AND WELCOME CONSTRUCTION COMPANY LIMITED jointly trading,GW-RS0060-13,"Section of Connaught Road West (westbound) Flyover between Shun Tak Centre and Western Street, Hong Kong.",22.396428,114.109497,28/01/2013
WAN CHAI,11/06/2013,17/01/2013,EXCEL ENGINEERING COMPANY LIMITED,GW-RS0063-13,"A section of Fleming Road near Convention Avenue, Wan Chai, HK",22.281731,114.174282,21/01/2013
EASTERN,31/07/2013,17/01/2013,CRBC - WCCL JV,GW-RS0065-13,Streets in Hong Kong Island  (Highways Department Term Contract No. 04/HY/2010).,22.2478599,114.2033843,01/02/2013
WAN CHAI,01/08/2013,24/01/2013,GAMMON CONSTRUCTION LIMITED,GW-RS0067-13,"Racecourse of Hong Kong Jockey Club, Happy Valley, HK",22.274424,114.180665,02/02/2013
CENTRAL AND WESTERN,03/08/2013,18/01/2013,LEIGHTON CONTRACTORS (ASIA) LIMITED,GW-RS0068-13,"Man Kwong Street, Finance Street and Man Po Street, Central, Hong Kong.",22.287104,114.15704,05/02/2013
EASTERN,31/07/2013,23/01/2013,Vibro (H.K.) Limited,GW-RS0069-13,"New Eastern Terrace for Proposed Residential Development at 1-15 New Eastern Terrace, 5-11 Dragon Road, Tin Hau, North Point, Hong Kong",-1,-1,01/02/2013
ISLANDS,30/06/2013,23/01/2013,REC Engineering Co. Ltd.,GW-RS0070-13,"Gas Turbine Unit No.5, Lamma Power Station, Lamma Island, Hong Kong. (Contract No.: 10/2216)",-1,-1,24/01/2013
WAN CHAI,24/07/2013,25/01/2013,CRBC - WCCL JV,GW-RS0071-13,"A section of Gloucester Road near Canal Road Flyover, Wan Chai, HK",22.276022,114.1751471,03/02/2013
WAN CHAI,10/07/2013,18/01/2013,GAMMON CONSTRUCTION LIMITED,GW-RS0072-13,"Wan Chai East Sewage Screening Plant, Hong Kong",22.396428,114.109497,24/01/2013
CENTRAL AND WESTERN,14/09/2013,22/01/2013,THE JARDINE ENGINEERING CORPORATION LIMITED,GW-RS0073-13,"MTR Central Station, Central, Hong Kong",-1,-1,15/03/2013
ISLANDS,25/07/2013,29/01/2013,LEADER CIVIL ENGINEERING CORP LTD,GW-RS0074-13,"Construction Site of Sewage Treatment Works at Yung Shue Wan, Lamma Island (Contract No. DC/2009/13)",-1,-1,29/01/2013
EASTERN,01/08/2013,22/01/2013,SUN FOOK KONG CONSTRUCTION LIMITED,GW-RS0075-13,"Sai Wan Ho MTR Station Concouse Level, Shau Kei Wan, HK",22.278746,114.2286476,02/02/2013
WAN CHAI,31/10/2013,23/01/2013,Hip Seng Construction Co. Ltd.,GW-RS0076-13,"A section of Harbour Road and a section of Convention Avenue near Convention Centre, Wan Chai, HK",22.276022,114.1751471,02/05/2013
WAN CHAI,23/07/2013,25/01/2013,SUN FOOK KONG (CIVIL) LTD,GW-RS0077-13,"A section of Wong Nai Chung Road near Hau Tak Lane, Wan Chai, HK",22.274473,114.178565,28/01/2013
ISLANDS,01/08/2013,25/01/2013,PAUL Y. CONSTRUCTION COMPANY LIMITED,GW-RS0079-13,"Lamma Power Station Building, Lamma Power Station, Outlying Island, NT",-1,-1,02/02/2013
SOUTHERN,31/05/2013,30/01/2013,CHUN WO CONST.& ENG. CO. LTD,GW-RS0080-13,"Hing Wo Street, Ka Wo Street and Tin Wan Street, Aberdeen, Hong Kong (WSD Contract No.:28/WSD/06)",-1,-1,31/01/2013
WAN CHAI,31/05/2013,28/01/2013,EXCEL ENGINEERING COMPANY LIMITED,GW-RS0082-13,"Two sections of Hennessy Road near Luard Road, Wan Chai, HK",22.277599,114.171617,31/01/2013
CENTRAL AND WESTERN,29/06/2013,23/01/2013,GAMMON CONSTRUCTION LIMITED,GW-RS0084-13,"10 Hollywood Road, Central Police Station Compound, Central, Hong Kong.",22.281772,114.154135,25/01/2013
WAN CHAI,17/08/2013,30/01/2013,"RAY ON CONSTRUCTION CO., LTD.",GW-RS0086-13,"A section of Russell Street near Canal Road East and a section of Canal Road East near Russell Street, Wan Chai, HK",22.27894,114.182859,18/02/2013
CENTRAL AND WESTERN,03/08/2013,23/01/2013,MING HING WATERWORKS ENGINEERING CO LTD,GW-RS0088-13,"Hillier Street, Sheung Wan, Hong Kong.",22.285676,114.151738,05/02/2013
WAN CHAI,02/08/2013,31/01/2013,CRBC - WCCL JV,GW-RS0092-13,"Whole Village Road, Happy Valley, Hong Kong",22.267848,114.184789,03/02/2013
EASTERN,17/08/2013,25/01/2013,Kum Shing (K F) Construction Company Limited,GW-RS0093-13,"King's Road near Pan Hoi Street to Westlands Road, Quarry Bay, HK",22.286334,114.21303,18/02/2013
EASTERN,31/05/2013,30/01/2013,WAI CHEONG CONSTRUCTION ENGINEERING LIMITED,GW-RS0094-13,"King's Road near North View Street, North Point, Hong Kong.",22.290369,114.196694,01/03/2013
SOUTHERN,21/07/2013,25/01/2013,LEIGHTON CONTRACTORS (ASIA) LIMITED,GW-RS0095-13,"Former bus depot (opposite to Ocena Park), Ocean Park Road, Wong Chuk Hang, Hong Kong.",22.24672,114.17409,27/01/2013
WAN CHAI,30/07/2013,31/01/2013,EXCEL ENGINEERING COMPANY LIMITED,GW-RS0097-13,"A section of Tung Lo Wan Road near Tung Lo Wan Drive, Causeway Bay, HK",22.279052,114.190018,04/02/2013
SOUTHERN,31/05/2013,28/01/2013,EXCEL ENGINEERING COMPANY LIMITED,GW-RS0099-13,"Wong Chuk Hang Road, Aberdeen, HK",22.249728,114.168782,31/01/2013
SOUTHERN,03/08/2013,04/02/2013,Leighton - John Holland Joint Venture,GW-RS0101-13,"Site Area at Ap Lei Chau Drive near Ap Lei Chau Bridge Road, Ap Lei Chau, Hong Kong (South Island Line (East) Contract 904)",-1,-1,04/02/2013
WAN CHAI,30/07/2013,31/01/2013,EXCEL ENGINEERING COMPANY LIMITED,GW-RS0102-13,"Three sections of Shan Kwong Road near Yuk Sau Street, Happy Valley, HK",22.268686,114.18567,04/02/2013
CENTRAL AND WESTERN,09/08/2013,25/01/2013,SUN FOOK KONG (CIVIL) LIMITED,GW-RS0104-13,"36-36C Queen’s Road Central and section of Theatre Lane, Central, Hong Kong.",22.282125,114.156898,17/02/2013
ISLANDS,03/08/2013,01/02/2013,CHINA STATE CONSTRUCTION ENGINEERING (HONG KONG) LIMITED,GW-RS0105-13,"Outlying Island, NT",-1,-1,04/02/2013
ISLANDS,31/07/2013,28/01/2013,UNION CONTRACTOR LTD.,GW-RS0106-13,"Passenger Terminal Building, Hong Kong International Airport, Chek Lap Kok (Contract No. M245-1 and M247-1)",-1,-1,01/02/2013
EASTERN,01/07/2013,29/01/2013,Gammon Construction Limited,GW-RS0108-13,"Island Eastern Corridor, West Bound, Ch1.300 to Ch3.190, Hong Kong.",22.396428,114.109497,02/03/2013
EASTERN,26/05/2013,31/01/2013,CHUN WO CONSTRUCTION & ENGINEERING CO. LTD.,GW-RS0109-13,"King's Road near Tin Chong Street, North Point, HK",22.290122,114.195461,23/02/2013
WAN CHAI,05/06/2013,06/02/2013,EXCEL ENGINEERING COMPANY LIMITED,GW-RS0112-13,"Three sections of Canal Road East near Sports Road, Wan Chai, HK",22.27563,114.182196,09/02/2013
CENTRAL AND WESTERN,31/05/2013,30/01/2013,GAMMON CONSTRUCTION LIMITED,GW-RS0113-13,"Old Bailey Street & Caine Road, Central, Hong Kong.",22.280602,114.153061,01/02/2013
CENTRAL AND WESTERN,06/08/2013,30/01/2013,LERMOND ENGINEERING LIMITED,GW-RS0116-13,"22-22A Des Voeux Road Central, Central, Hong Kong.",22.282522,114.1573107,07/02/2013
WAN CHAI,06/07/2013,06/02/2013,EXCEL ENGINEERING COMPANY LIMITED,GW-RS0118-13,"Three sections of Hennessy Road near Johnston Road, Wan Chai, HK",22.276663,114.173445,08/02/2013
ISLANDS,10/08/2013,05/02/2013,Dragages - China Harbour - VSL Joint Venture,GW-RS0119-13,"Outlying Island, NT",-1,-1,16/02/2013
SOUTHERN,11/08/2013,07/02/2013,LEIGHTON CONTRACTORS (ASIA) LIMITED,GW-RS0121-13,"AREA BETWEEN AP LEI CHAU BRIDGE ROAD AND HOLY SPIRIT SEMINARY, NEAR THE ABERDEEN CHANNEL ON THE HONG KONG ISLAND SIDE",-1,-1,17/02/2013
ISLANDS,04/08/2013,08/02/2013,CHINA HARBOUR ENGINEERING COMPANY LIMITED,GW-RS0122-13,Construction Site of Hong Kong-Zhuhai-Macao Bridge Hong Kong Boundary Crossing Facilities - Reclamation Works (Contract No.: HY/2010/02),-1,-1,08/02/2013
CENTRAL AND WESTERN,29/06/2013,04/02/2013,"KELLY CONSTRUCTION CO., LTD",GW-RS0123-13,"100 Connaught Road Central & 199 Des Voeux Road Central, Central, Hong Kong",22.286393,114.153706,04/02/2013
WAN CHAI,06/08/2013,06/02/2013,EXCEL ENGINEERING COMPANY LIMITED,GW-RS0125-13,"A section of Leighton Road near Matheson Street, Causeway Bay, HK",22.277967,114.182663,10/02/2013
WAN CHAI,31/07/2013,06/02/2013,CRBC - WCCL JV,GW-RS0127-13,"A Section of Tung Lo Wan Road near Moreton Terrace, Causeway Bay, HK",22.279339,114.189196,25/02/2013
ISLANDS,13/08/2013,08/02/2013,CHINA STATE CONSTRUCTION ENGINEERING (HONG KONG) LIMITED,GW-RS0128-13,"Storage Area at Works Area WA3, Siu Ho Wan of Hong Kong-Zhuhai-Macao Bridge Hong Kong Link Road - Section between Scenic Hill and Hong Kong Boundary Crossing Facilities (Contract No. HY/2011/03)",-1,-1,14/02/2013
WAN CHAI,01/07/2013,01/02/2013,Program Contractors Ltd.,GW-RS0130-13,"MTR Causeway Bay Station, Hong Kong",22.280209,114.184116,05/02/2013
WAN CHAI,16/08/2013,06/02/2013,HONG KONG TRAMWAYS LIMITED,GW-RS0131-13,"Tram track between Kennedy Town and Shau Kei Wan, Hong Kong.",22.278746,114.2286476,17/02/2013
CENTRAL AND WESTERN,27/08/2013,07/02/2013,MING HING WATERWORKS ENGINEERING CO LTD,GW-RS0132-13,"Murray Road, Central, HK",22.280794,114.162025,28/02/2013
SOUTHERN,24/08/2013,08/02/2013,LEIGHTON - LNS JOINT VENTURE,GW-RS0134-13,"Pokfulam, HK",22.2679201,114.1290719,25/02/2013
SOUTHERN,31/08/2013,08/02/2013,Leighton - LNS Joint Venture,GW-RS0135-13,"Cyberport Sewage Treatment Plant, Pokfulam, HK",22.2679201,114.1290719,28/02/2013
CENTRAL AND WESTERN,13/08/2013,08/02/2013,CHINA STATE CONSTRUCTION ENGINEERING (HONG KONG) LIMITED,GW-RS0137-13,"Junction of Lyndhurst Street & Gage Street, Central, Hong Kong",22.282524,114.153941,14/02/2013
CENTRAL AND WESTERN,26/08/2013,08/02/2013,Gammon - Nishimatsu Wil Joint Venture,GW-RS0138-13,"9B Bonham Road, Sai Ying Pun, Hong Kong.",22.396428,114.109497,27/02/2013
WAN CHAI,05/08/2013,06/02/2013,EXCEL ENGINEERING COMPANY LIMITED,GW-RS0139-13,"Two sections of Gloucester Road near Arsenal Street, Wan Chai, Hong Kong",22.278835,114.168934,09/02/2013
ISLANDS,14/08/2013,08/02/2013,GAMMON CONSTRUCTION LIMITED,GW-RS0140-13,"Outlying Island, NT",-1,-1,14/02/2013
WAN CHAI,05/06/2013,08/02/2013,EXCEL ENGINEERING COMPANY LIMITED,GW-RS0141-13,"A section of Fenwick Street near Jaffe Road, Wan Chai, HK",22.279067,114.176815,11/02/2013
WAN CHAI,05/07/2013,08/02/2013,EXCEL ENGINEERING COMPANY LIMITED,GW-RS0142-13,"Two sections of Hennessy Road between O'Brien Road and Fleming Road, Wan Chai, Hong Kong",-1,-1,11/02/2013
SOUTHERN,18/08/2013,06/02/2013,CRBC - WCCL JV,GW-RS0143-13,"Beach Road section between Lamp Post 31642 and Lamp Post 45439, Repulse Bay, Hong Kong (Highways Department Contract No. 04/HY/2010)",-1,-1,19/02/2013
CENTRAL AND WESTERN,13/08/2013,08/02/2013,CHINA STATE CONSTRUCTION ENGINEERING (HONG KONG) LIMITED,GW-RS0144-13,"2 Western Street, Sai Ying Pun, Hong Kong.",22.287329,114.142445,14/02/2013
WAN CHAI,17/08/2013,08/02/2013,CRBC - WCCL JV,GW-RS0147-13,"A section of Victoria Park Road Flyover near Gloucester Road, Wan Chai, Hong Kong",22.280703,114.179064,18/02/2013
EASTERN,19/08/2013,14/02/2013,CHINA ROAD BRIDGE CORPORATION - WELCOME CONSTRUCTION COMPANY LIMITED JOINT VENTURE,GW-RS0149-13,"Cheung Man Road, Chai Wan, HK",22.268078,114.236813,20/02/2013
SOUTHERN,30/06/2013,07/02/2013,LEIGHTON CONTRACTORS (ASIA) LIMITED,GW-RS0153-13,"Nam Long Shan Road, Wong Chuk Hang, HK",22.240853,114.167734,14/02/2013
CENTRAL AND WESTERN,13/08/2013,08/02/2013,CHINA STATE CONSTRUCTION ENGINEERING (HONG KONG) LIMITED,GW-RS0154-13,"Connaught Road Central and Edinburgh Place, Central, Hong Kong.",22.281647,114.162228,14/02/2013
WAN CHAI,14/08/2013,15/02/2013,Chun Wo - CRGL Joint Venture,GW-RS0155-13,"A section of Wan Shing Street near Hung Hing Road, Wan Chai, HK",22.282835,114.179813,16/02/2013
CENTRAL AND WESTERN,30/07/2013,08/02/2013,CHINA STATE CONSTRUCTION ENGINEERING (HONG KONG) LIMITED,GW-RS0156-13,"78-120 Wellington Street, Central, Hong Kong.",-1,-1,14/02/2013
CENTRAL AND WESTERN,13/08/2013,08/02/2013,SUN FOOK KONG (CIVIL) LIMITED,GW-RS0157-13,"Junction of  Morrison Street & New Market Street, Sheung Wan, Hong Kong.",22.28693,114.150454,14/02/2013
CENTRAL AND WESTERN,13/08/2013,14/02/2013,CHINA STATE CONSTRUCTION ENGINEERING (HONG KONG) LIMITED,GW-RS0160-13,"84-168 Des Voeux Road Central & a section of Jubilee Street, Central, Hong Kong",22.285612,114.153986,18/02/2013
ISLANDS,29/06/2013,15/02/2013,VIBRO (H. K.) LIMITED,GW-RS0161-13,"Outlying Island, NT",-1,-1,18/02/2013
EASTERN,25/06/2013,22/02/2013,EXCEL ENGINEERING COMPANY LIMITED,GW-RS0162-13,"Island Eastern Corridor near Provident Centre, North Point, HK",22.291975,114.195394,26/02/2013
SOUTHERN,18/08/2013,08/02/2013,Leighton Contractors (Asia) Ltd,GW-RS0163-13,"Former Wong Chuk Hang Estate and Wong Chuk Hang Nullah (section of area next to former Wong Chuk Hang Estate), Wong Chuk Hang, Hong Kong.",-1,-1,24/02/2013
ISLANDS,07/07/2013,08/02/2013,CLP ENGINEERING LIMITED,GW-RS0165-13,"South Runway Road and Catering Road Central near Dah Chong Hong - Dragonair Airport GSE Services, Chek Lap Kok",22.3083934,113.923907,08/02/2013
WAN CHAI,13/08/2013,14/02/2013,Chun Wo - Leader Joint Venture,GW-RS0166-13,"Victoria Harbour near HKCEE, Wan Chai, HK",22.276022,114.1751471,16/02/2013
EASTERN,19/07/2013,19/02/2013,EXCEL ENGINEERING COMPANY LIMITED,GW-RS0167-13,"King's Road between Shu Kuk Street and Kam Hong Street, North Point, HK",22.292038,114.20152,19/02/2013
